id,keyword,location,text,target
245,airplane%20accident,Toronto,Could a drone cause an airplane accident? Pilots worried about use of drones esp. in close vicinity of airports http://t.co/kz35rGngJF #,1
6525,injuries,Toronto,All injuries Pre Foster/Floyd. Those will be covered next week. https://t.co/zRZEjPEF5j,0
763,avalanche,,Secrets up avalanche: catechize inner self for the confidential communication as respects creating worth in len...,0
9195,suicide%20bombing,"Minority Privilege, USA",@sonofbobBOB @Shimmyfab @trickxie usually I'd agree. Once the whole chopping heads off throwing gays off rooftops &amp; suicide bombing start,1
8953,storm,mind ya business,@Jenniferarri_ comeeeee! ...but why is it bout to storm tho,1
8810,sirens,"Seattle, WA",@KIRO7Seattle Just saw a Bomb Squad car heading north on Elliott with sirens on - any word on where they're headed??,1
9162,suicide%20bomber,United States,Suicide bomber 'hits Saudi mosque' http://t.co/kE6DjxAnmm,1
3947,devastated,ACCRA GHANA,Obama Declares Disaster for Typhoon-Devastated Saipan: Obama signs disaster declaration for Northern Marians a... http://t.co/XDt4VHFn7B,1
5446,first%20responders,USA,First Responders Convene for National Summit and Awards on GIS Technology http://t.co/0T9yd557rY #gisuserPR #geoTech,0
8236,riot,Seattle,Southeast Dirt Riot Series Crowns Champions:  Southeast Dirt Riot Series Crowns ChampionsBLACKFOOT ID: The So... http://t.co/v9i4PfXO0C,0
3162,deluge,,Towboat trek sympathy deluge falls: VTc http://t.co/eaaQUMkkc9,1
6372,hostages,,"No #news of #hostages in #Libya

http://t.co/bjjOIfzUhL

#India #terrorism #Africa #AP #TS #NRI #News #TRS #TDP #BJP http://t.co/IywZAlLsN4",1
509,army,"Memphis, TN",Salvation Army hosts rally to reconnect fathers with children: The Salvation Army is hosting a back to school rallyÛ_ http://t.co/rDjpor3AZg,1
781,avalanche,Brasil,Paul Rudd Emile Hirsch David Gordon Green 'Prince Avalanche' Q&amp;A | Filmmakers at Google http://t.co/e4QonKzndZ  #entretenimento #Video,0
5061,famine,,Russian 'food crematoria' provoke outrage amid crisis famine memories: MOSCOW (Reuters) - Russian government ... http://t.co/Mphog0QDDN,1
738,attacked,"The Hammock, FL, USA",Christian Attacked by Muslims at the Temple Mount after Waving Israeli Flag via Pamela Geller - ... http://t.co/yUBKHf9iyh,1
3859,detonation,,Look down upon three methods touching obtaing rank electrical transcription detonation: BuTIQOb,0
5784,forest%20fires,"Sacramento, CA",Firefighting consumes Forest Service budget sparks political clash: Forest Service report cites increasing cost ofÛ_ http://t.co/lSWsitnkuk,1
4810,evacuated,"Gold Coast, Australia",Tram travellers evacuated after powerlines come down in Surfers http://t.co/Qsheu3yF0W,1
3132,debris,"Dubai, United Arab Emirates",What Irony Debris of Flight MH370 found on 'Reunion Island'.,1
7601,pandemonium,"The Kingdom of Fife, Scotland",@hashtagteaclub place out. It was ex Pars defender Andy Tod in full uniform. It was instant pandemonium. Utter mayhem ensued!,0
1363,blown%20up,,Things you CAN pick up from tozlet seat|: butt leprosy full-blown jerkface syndrome a lateral lisp &amp; toilet rickets.,0
2142,catastrophe,Lytham St Anne's ,"Oh my god thatÛªs the biggest #gbbo catastrophe I have EVER seen. 

Not that I watch the show or am into it at all ??",0
5760,forest%20fires,Tips on my blog at,Tales of the #trees #deep water loving #Lake Tahoe. And no #forest fires https://t.co/xuhMJ098Lq,0
6793,lightning,Reddit ,Lightning strike in the distance via /r/pics http://t.co/iDmhSwewQw #pics http://t.co/wwxcOB52zI,1
5346,fire,Arizona,There's a fire in the Catalinas. Looks kinda cool. This picture doesn't do it justice. https://t.co/N0tAwGeZJx,1
9456,terrorism,"New Jersey, USA",Cross-border terrorism: Pakistan caught red-handed again http://t.co/uDj50J3MV4,1
3425,derail, Road to the Billionaires Club,@GloriaVelez GM! I pray any attack of the enemy 2 derail ur destiny is blocked by the Lord &amp; that He floods ur life w/heavenly Blessings,0
4650,engulfed,,Men escape car engulfed in flames in Parley's Canyon crews investigating cause - http://t.co/P6cyLz5lpt http://t.co/Jpu9gIps9f,1
10274,war%20zone,,Looks and sounds like a war zone,1
4430,electrocute,Here.,Let her go - Passenger,0
2382,collapsed,,On the 2nd year the officer team running the club collapsed. A few influential members betrayed everyone's trust severing the community.,0
7565,outbreak,,Families to sue over Legionnaires: More than 40 families affected by the fatal outbreak of Legio... http://t.co/uCBfgIBFOR #MuhamadJabal,1
1294,bloody,Nashua NH,@TradCatKnight (1) Russia may have played into reason but that link is BS.  Okanowa was bloody and mainline invasion looked like a bloody,1
3193,deluge,"Fort Fizz, Ohio",Vince McMahon once again a billionaire: I remember reading a deluge of posts about Vince McMahon losing $350 m... http://t.co/ko0oz3RYFg,0
8696,sinking,,@supernovalester I feel so bad for them. I can literally feel that feeling of your heart sinking bc you didn't get anyone ugh jfc,0
4337,dust%20storm,Worldwide,New Mad Max Screenshots Show Off a Lovely Dust Storm Combat Magnum Opus http://t.co/VRpmplcZCY,0
7537,oil%20spill,Financial News and Views,Refugio oil spill may have been costlier bigger than projected http://t.co/EFCn9IVNfg A Plains All American Pipeline oil spill off the SÛ_,1
2505,collision,'soooota,@Zojadelin you literally almost had a head on collision with us today on pilot knob,1
10075,typhoon,USA,Typhoon Soudelor taking dead aim at Taiwan http://t.co/3Ac5wuy1R0,1
4398,electrocute,Here.,@Adanne___ kindly follow back,0
3286,demolish,"London, UK",The far right racist #AvigdorLiberman calls for destruction of #Susiya ! Previously he also called for beheadings!   http://t.co/Li8otXt8hh,1
6980,massacre,,@gigagil IOF murdered over 513 Palestinian children (70% under 12) during Gaza Massacre where was zionist morality-zionism is a world evil!,1
134,accident,,8/6/2015@2:09 PM: TRAFFIC ACCIDENT NO INJURY at 2781 WILLIS FOREMAN RD http://t.co/VCkIT6EDEv,1
9463,terrorism,,"Does this apply to Muslims/terrorism?
Or Catholicism/homophobia?",0
5213,fatality,,@Truly_Stings Yo Dm me,1
651,attack,,http://t.co/pTKrXtZjtV  Nashville Theater Attack: Will Gun Grabbers Now Demand ÛÏHatchet Control?Û,1
4363,earthquake,TÌÁchira - Venezuela,#SCSeEstaPreparando Light mag. 4.4 earthquake  - - 73km SW of Khuzdar Pakistan on Wednes... http://t.co/i6lmcccLv5 via @volcanodiscover,1
8257,rioting,,Still rioting in a couple of hours left until I have to be up for class.,1
7752,police,Indonesia,Police kill hatchet-wielding gunman who opened fire inside Nashville movie theater: AåÊmiddle-aged manåÊarmed wi... http://t.co/tyD47NfL5x,1
3473,derailed,"DC, frequently NYC/San Diego",Whoa a #wmata train derailed at Smithsonian?,1
2797,curfew,IM LOST ,Da Judge Gave Dis Girl 5pm Curfew ??????,0
4454,electrocuted,,I got electrocuted this morning how is your day going? ??,0
3395,demolition,"Washington, DC",China detains seven Christians trying to protect their church's cross from demolition http://t.co/XuUB2HBlI5 http://t.co/h5EPx2D1ga,0
4735,evacuate,wrapped arnd hyuk's finger,@joonma_ dealbreaker that's it that's the dealbreaker s.o.s. abandon ship evacuate the building,1
10840,,,#Sismo DETECTADO #JapÌ_n 15:41:07 Seismic intensity 0 Iwate Miyagi JST #?? http://t.co/gMoUl9zQ2Q,1
9541,terrorist,Iraq|Afghanistan| RSA |Baghdad,Don't say @ALIPAPER: women got problems this #keepingtheviginaclean thing is very interesting n less expensive #metrofmtalk',0
6458,injured,london,Udhampur terror attack: Militants attack police post 2 SPOs injured http://t.co/zMWeCBWVaO,1
8143,rescuers,Westerland,VIDEO: 'We're picking up bodies from water': Rescuers are searching for hundreds of migrants in the Mediterran... http://t.co/s5NuEGSwYj,1
794,avalanche,,Chevrolet : Avalanche LT 2011 lt used 5.3 l v 8 16 v automatic 4 wd pickup truck premium bÛ_ http://t.co/OBkY8Pc89H http://t.co/dXIRnTdSrd,1
4241,drowned,U.S.A. - Global Members Site,Hundreds feared drowned as migrant boat capsizes off Libya http://t.co/pPJi1tCNML,1
5889,harm," Queensland, Australia",Vanderbilt: First Do No Harm http://t.co/cCdx7CGlQW,0
6039,heat%20wave,"Greenfield, Massachusetts","Many thx for share and your comment Alex Lightman - 

What evidence did it take or will it take for you or your... http://t.co/4Wsva9WO0F",0
2398,collapsed,"From NY. In Scranton, PA",Apparently part of the building just collapsed. Hope everyone is ok.,1
8587,screams,labyrinthia,@harveymaine AAAA ok lemme move to another roomr so no one hears my gay ass screams,0
7158,mudslide,Tring ,@marc_holl @NenniCook @AitchKayCee @vixstuart @benjbeckwith It's not pretty ??#disaster #GBBO #mudslide,1
4853,evacuation,"Portland, Ore. ",New evacuation ordered for 25 homes in danger of Hwy. 8 fire near Roosevelt Wash. http://t.co/SQsyUeh4yI #KOIN6News http://t.co/199t7ND0pm,1
3355,demolition,USA,EPA begins demolition of homes in toxic area #Buffalo - http://t.co/noRkXBRS6G,1
8658,sinkhole,"White Plains, NY",I've been trying to write a theological short story about a monster living in a sinkhole. Then I heard about Brooklyn. #accidentalprophecy,0
3133,debris,India,MH370: Aircraft debris found on La Reunion is from missing Malaysia Airlines ... - ABC Online http://t.co/C5JuTFXBM9,1
5115,fatal,"ÌÏT: 10.614817868480726,12.195582811791382",Boy 11 charged with manslaughter in shooting death of Elijah Walker: The 11-year-old appeared Wednesday in a... http://t.co/gtcFfaCvam,1
5437,first%20responders,"Liberty Township, Ohio",@Reds I don't throw the word hero around lightly... Usually reserved for first responders and military... But he's a hero...,0
8933,snowstorm,Mountains,New #photo Oak in a snowstorm http://t.co/JhSCGDA2G8 on the #SouthDowns #Hampshire #Winter #photography #art #tree #treescape #treeporn,0
8872,smoke,,@BillMcCabe  sky looks clear.... No smoke from the fires. Enjoy your time in Tahoe. One of my favorite places!,1
2870,damage,"Lawrence, KS via Emporia, KS",Hey the #Royals love doing damage with 2 outs.,1
1459,body%20bagging,Global,Drake Body Bagging Meek. He must of hit a sensitive spot talking about a 'ghostwriter.' He trying 2 end his career. http://t.co/2jHTlWueY0,0
8146,rescuers,Surabaya,VIDEO: 'We're picking up bodies from water': Rescuers are searching for hundreds of migrants in the Mediterran... http://t.co/GEU4H46CsZ,1
9741,tragedy,Orlando ,Back home they mad cause I chill with the white boys .,0
10444,wild%20fires,"Los Angeles, CA",Map shows where all of California's wild#fires are burning: This map created by CAL FIREÛ_ http://t.co/0x8jAQToWM http://t.co/m1RoSi2Wcs,1
3853,detonation,,Ignition Knock (Detonation) Sensor-Senso Standard KS94 http://t.co/IhphZCkm41 http://t.co/wuICdTTUhf,1
1634,bombing,,Japan on Thursday marks the 70th anniversary of the atomic bombing of Hiroshima with the most senior official from Washington ever scheduleÛ_,1
2227,chemical%20emergency,,Google Alert: Emergency units simulate a chemical explosion at NU http://t.co/NDgpWYxu6H,0
2284,cliff%20fall,Suplex City,@punkblunts @sincerelyevelnn fall off a cliff into hell idc,0
3448,derail,"Los Angeles, CA",@GoP establishment is working overtime to derail #DONZILLA... @realDonaldTrump #Trump2016  https://t.co/XVaOQo4EgR,0
7306,nuclear%20reactor,,US Navy Sidelines 3 Newest Subs - http://t.co/guvTIzyCHE: DefenseNews.comUS Navy Sidelines 3 Newest SubsD... http://t.co/SY2WhXT0K5 #navy,1
5064,famine,"Kyiv, Ukraine",#Russia 'food crematoria' provoke outrage in country w/soaring poverty +Soviet famine memory http://t.co/vymOuZjZRe http://t.co/eNRJh5Qkve,1
5444,first%20responders,Michigan,Kirsten Gillibrand http://t.co/amEA3LaMDj    Extend Health Care To 911 First RESPONDERS !,1
7111,military,,@kiranahmedd US military and Nato are fighting Talibans too,1
6505,injuries,,@nalathekoala As a health care professional that deals all gun violence sequalae I consider suicides injuries accidents and homicides,0
2453,collide,"Dallas, Texas. ",You either ride with us or collide with us. It's as simple as that for me and my niggas.,0
7585,outbreak,"Ile-Ife,Osun state, Nigeria",#News Families to sue over Legionnaires: More than 40 families affected by the fatal outbreak of Legionnaires'... http://t.co/zfYqSAwvrk,1
6693,landslide,,This Govt of Hubris has small maj yet acts as if it has a landslide. Opposition req'd with vision rigour &amp; hunger to serve this democracy.,0
8912,snowstorm,"South, USA",Sassy city girl country hunk stranded in Smoky Mountain snowstorm #AoMS http://t.co/ZDJ2hyF6RO #ibooklove #bookboost,0
10101,typhoon,The Peach State,I think a Typhoon just passed through here lol,1
5772,forest%20fires,,CLIMATE CONSEQUENCES: U.S. Forest Service Says Spending More Than Half Of Budget On Fires http://t.co/k0QtL8aODH http://t.co/zQBXe7x9Y7,1
10545,windstorm,,Texas Seeks Comment on Rules for Changes to WindstormåÊInsurer http://t.co/92fwtObi3U,1
990,blazing,,Bit pacquiao vs marquez 3 unfilled blazing swarm online: DuRvOd http://t.co/6VJA8R4YXA,0
5075,famine,,'Food crematoria' provoke outrage amid crisis famine memories... http://t.co/REsxAvgpyJ,1
6072,heat%20wave,"Oklahoma City, OK",Longest Streak of Triple-Digit Heat Since 2013 Forecast in Dallas: An unrelenting and dangerous heat wave will... http://t.co/s4Srgrmqcz,1
4123,drought,USA (Formerly @usNOAAgov),#DroughtMonitor: Moderate or worse #drought ? to ~27% of contig USA; affects ~80M people. http://t.co/YBE9JQoznR http://t.co/328SzflEtZ,1
10567,windstorm,,A fierce windstorm can't take place without da calm/stillness of the eye/center so w/ that said ur internal aspects weigh more than external,0
3084,deaths,,It's Time To Reduce Gun Deaths http://t.co/ilADQEBxPn,1
8028,refugees,,y'all read 12000 Nigerian refugees repatriated from Cameroon http://t.co/aVwE1LBvhn,1
731,attacked,Arundel ,Christian Attacked by Muslims at the Temple Mount after Waving Israeli Flag via Pamela Geller - ... http://t.co/T1aa5Ov7Eg,1
8823,sirens,"Hamburg, DE",A new favorite: Midfield General  Disco Sirens House Edm Version Soni Soner by @sonisoner https://t.co/DEvffPTCVj on #SoundCloud,0
126,accident,,Carolina accident: Motorcyclist Dies in I-540 Crash With Car That Crossed Median: A motorcycle rider traveling... http://t.co/p18lzRlmy6,1
3895,detonation,Geneva,70 years after : Hiroshima and Nagasaki - consequences of a nuclear detonation @ICRC http://t.co/BKh7Z6CWWl,1
7413,obliterated,,Drunk Meals 101: What To Cook When You're Totally Obliterated http://t.co/QvS7O10bG3,0
6857,mass%20murder,New York,We have different moral systems. Mine rejects the mass murder of innocents yours explicitly endorses such behavior. https://t.co/qadRKEJZ9T,1
888,bioterrorism,"San Francisco, CA",A Tale of Two Pox - Body Horrors http://t.co/W2IXT1k0AB #virus #infectiousdiseases #bioterrorism,1
1661,bombing,,Today is the day Hiroshima got Atomic bomb 70 years ago.  - The 'sanitised narrative' of Hiroshima's atomic bombing http://t.co/GKpANz7vg0,1
3471,derailed,"Chicago, IL",New illustration for the L.A. Times: http://t.co/qYn6KxJSTl #illustration #subway,0
52,ablaze,"Philadelphia, PA",Crying out for more! Set me ablaze,0
8842,smoke,,What's wrong with just a lil smoke and good conversation ????,0
5383,fire%20truck,lost in my thoughts,@eeenice221 true because of the truck that caught fire?,1
10511,wildfire,USA,The Latest: Washington #Wildfire misses town; evacuations end - KHQ Right Now http://t.co/aNlhW2IzkZ,1
7691,panic,,just had a panic attack bc I don't have enough money for all the drugs and alcohol I wanted to buy this year let alone my fall bills,0
9749,tragedy,MÌ©xico,"I'm gunning down romance
It never did a thing for me
But heartache and misery
Ain't nothing but a tragedy http://t.co/jhUPOgbvs8",0
3656,destroy,Honduras,Black Ops 3 SEARCH AND DESTROY GAMEPLAY! (Hunted SnD Competitive Multiplayer): http://t.co/ss1zL36y9V via @YouTube,0
6867,mass%20murder,"Melbourne, Australia",Hiroshima - one of history's worst examples of mass murder  http://t.co/TmogTi6FB4 #hiroshima #war #atombomb #japan,1
932,blaze,,Life is amazin same time its crazy niggas dey wanna blaze me hate it because i made it all it took was dedication n some motivation,0
9592,thunder,,That was the l9udest thunder I've  ever heard,0
5298,fear,Athens - Nicosia,Couples having less sex... for fear it'll be a let down: Internet movies and books saying how sex 'ought to be' pÛ_ http://t.co/c1xhIzPrAd,0
9401,survivors,Port Williams NS,Patient-reported outcomes in long-term survivors of metastatic colorectal cancer - British Journal of Surgery http://t.co/5Yl4DC1Tqt,1
4826,evacuation,Sydney Australia,Our mission to see the end of this movie last night @markoturner @annaciclismo after getting fire alarm evacuation http://t.co/5kFOVovjso,1
9298,survive,Lincoln City Oregon,10 Ways To Survive and Escape Martial Law | World http://t.co/BiuEY7bUtS http://t.co/JWQYbe4ep1,0
7523,oil%20spill,,Refugio oil spill may have been costlier bigger than projected http://t.co/gtHddzAvhg #LosAngelesTimes #latimes #news,1
9861,traumatised,,I'm so traumatised.,0
6764,lightning,,Science Daily: Lightning reshapes rocks at the atomic level - A lightning strike can reshape a mineral's crystal s... http://t.co/TEZLTqeyw2,1
6376,hostages,,"One Year on from the Sinjar Massacre #Yazidis Blast Lack of Action Over Hostages
http://t.co/BAqOcMcJqc",1
10409,whirlwind,Stamford & Cork (& Shropshire),I moved to England five years ago today. What a whirlwind of time it has been! http://t.co/eaSlGeA1B7,1
4600,emergency%20services,,@Glenstannard @EssexWeather do you know where abouts as I heard emergency services near by,1
6738,lava,buffalo / madrid / granada,let's play the floor is lava but instead of just the floor let's play with the whole world and never get out of bed http://t.co/aKQ4RwjFVL,0
10799,wrecked,,James Kunstler: How bad architecture wrecked cities http://t.co/Ac6I3tE8mT #residualincome #mlm http://t.co/Wq0JLsHW1g,0
2720,crushed,U.K.,Man crushed to death by own car http://t.co/CrPO9DkW9v,1
8202,riot,,"@teamVODG Discovered by @NickCannon 
 Listen/Buy @realmandyrain #RIOT on @iTunesMusic @iTunes https://t.co/dehMym5lpk Û_ #BlowMandyUp",0
6061,heat%20wave,Malaysia/Jordan,It's kinda cool tonight. Is the heat wave finally over?? ???? 7amdollela 3la kulli 7aal,1
3264,demolish,,Ugh So hungry I'm going to demolish this food!,0
3101,deaths,"ÌÏT: 10.614817868480726,12.195582811791382",Bigamist and his 'first' wife are charged in the deaths of his 'second' pregnant wife her child 8 her mothe... http://t.co/rTEuGB5Tnv,1
9889,traumatised,,@CiaraMcKendry mine came on the day after my data renewed this month i was traumatised,0
3944,devastated,,@emmerdale I'll be devastated if it's cain...such a great character ??,0
2418,collide,"Silang, Cavite / ParaÌ±aque",Lets collide untill we fill the space.. ??,0
10777,wreckage,,Wreckage 'Conclusively Confirmed' as From MH370: Malaysia PM: Investigators and the families of those who were... http://t.co/yi54XRHQGB,1
4661,engulfed,,Tube strike live: Latest travel updates as London is engulfed in chaos: Û_  cross-London travel will be accepte...  http://t.co/vg8HRbebdA,1
5079,famine,Texas,The famine is coming to an end #Bluebell http://t.co/p9ryMfjcUX,1
9281,sunk,Gloucester,@bonhomme37 wouldn't that have sunk the sub?,0
5662,floods,,"Who is bringing the tornadoes and floods. Who is bringing the climate change. God is after America He is plaguing her
 
#FARRAKHAN #QUOTE",1
4358,earthquake,"California, USA",USGS EQ: M 0.6 - 8km SSW of Anza California: Time2015-08-06 01:26:24 UTC2015-08-05 18:26:24 -07:0... http://t.co/3bwWNLsxhB #EarthQuake,1
814,battle,,A young German stormtrooper engaged in the Battle of the Somme 1916. [800 ÌÑ 582 ] http://t.co/yxvMifLvc4,1
4944,exploded,Jamaica,@ItsNasB now I have to go replace my sarcasm meter which just exploded. -__-,0
10534,wildfire,"Bakersfield, California",#California #wildfire destroys more homes but crews advance. http://t.co/2PPzGpxybi http://t.co/dS9khKffwc,1
717,attacked,London,Christian Attacked by Muslims at the Temple Mount after Waving Israeli Flag via Pamela Geller - ... http://t.co/wGWiQmICL1,1
6482,injured,Avon,@Welles_7 he was injured. He is a pro bowl back.,0
4050,displaced,,Crews were out all day boarding up windows at the park at the Galleria apts. where fire displaced 55 this AM. http://t.co/NMPN2mqZgE,1
5375,fire%20truck,SouthEast Asia,Former Township fire truck being used in Philippines - Langley Times http://t.co/L90dCPV9Zu #Philippines,1
3338,demolished,,@David5Fernandez @theblaze trump will get absolutely demolished in a general election.,0
6402,hurricane,"Anderson, SC",hurricane?? sick!,1
2673,crush,,My Lil brother has a crush on mariah ??????,0
4678,engulfed,,#RaheelSharif is manifesting how one RIGHT man at the helm can save a Sinking Ship engulfed in a Dark-Stormy-Tidal-Sea. Well Done.,1
6546,injury,,Enter the world of extreme diving ÛÓ 9 stories up and into the Volga River http://t.co/dMTZMgyRiK,0
3190,deluge,"Atlanta, Ga",Only SHADOWMAN can save the Big Easy from a deluge of supernatural monstrosities... Read free: http://t.co/TBpQlYfYoT http://t.co/hDcKePosqc,0
4205,drowned,The Howling,the future of america #GamerGate http://t.co/UhF7NyAbSw,0
6992,massacre,India,The Martyrs Who Kept Udhampur Terrorists at Bay Averted a Massacre: It was two youngÛ_ http://t.co/nux5XfPV2d SPSå¨,1
6354,hostages,,"No #news of #hostages in #Libya

http://t.co/eXil1bKzmP

#India #terrorism #Africa #AP #TS #NRI #News #TRS #TDP #BJP http://t.co/ehomn68oJB",1
5655,flooding,belleville,@kwislo I see her flooding at mad decent,0
3674,destroy,Trackside California,Wow Crackdown 3 uses multiple servers in multiplayer?!?! U can destroy whole buildings?!?! #copped,0
8920,snowstorm,Deployed in the Middle East,@CacheAdvance besides your nasty thunderstorm or snowstorm nah. Can't say that I have.,0
2661,crush,"Cleveland, Ohio",My woman crush wedneday goes to the beautiful @taykreidler #loveyouuuu #aintsheperty https://t.co/WeMwdtFwiC,0
3593,desolate,,The Desolate Hope: Part 2: MIRAD: http://t.co/c6lGtOTVSF via @YouTube,0
4576,emergency%20plan,Im In Route ,"ÛÏ@based_georgie: yo forreal we need to have like an emergency action plan incase donald trump becomes presidentÛ
Whipe that lil baby",1
8866,smoke,WORLDWI$E ,I smoke toooooo much lmao I was scared to text this number bck but now it all makes sense lol,0
1317,bloody,,@MelRises @gayler1969 @wwwbigbaldhead @jessienojoke @melissaross9847 if my Monty Python is up to date as bloody far as he wants to go.,0
6277,hijacking,Malaysia,The Murderous Story Of AmericaÛªs First Hijacking http://t.co/jmAwRLt7HB,1
375,annihilation,,@Whippenz We need help! Horses will die!Please RT &amp; sign petition!Take a stand &amp; be a voice for them! #gilbert23 https://t.co/e8dl1lNCVu,0
4350,earthquake,,Contruction upgrading ferries to earthquake standards in Vashon Mukilteo - Q13 FOX http://t.co/E981DgSkab #EarthquakeNews,1
10396,whirlwind,,"life can wild when... 
you're caught in a whirlwind ??",1
6,,,"13,000 people receive #wildfires evacuation orders in California ",1
49,ablaze,Est. September 2012 - Bristol,We always try to bring the heavy. #metal #RT http://t.co/YAo1e0xngw,0
9716,tragedy,,Rly tragedy in MP: Some live to recount horror: ÛÏWhen I saw coaches of my train plunging into water I called ... http://t.co/72ix7vM87w,1
3613,desolation,,RT kurtkamka: Beautiful desolation. Just me a couple of coyotes some lizards and the morning sun. #Phoenix #ArizÛ_ http://t.co/0z1PvJVdpf,1
9766,trapped,central chazifornia,salute to all the kids still trapped in adult bodies.,0
6821,loud%20bang,"Wandsworth, London",@SW_Trains strange loud impact bang noises under train to Epsom about to arrive #Wimbledon,0
10636,wounds,Charlotte ,Gunshot wound #9 is in the bicep. The only one of the ten wounds that is not in the chest/torso area.  #KerrickTrial #JonathanFerrell,1
3295,demolish,KOLKATA,@Jolly_Jinu you said they are terrorist because of #Babri so was it ok? If you demolish my house todayhave i right to take revenge?,0
4113,drought,,Treasures revealed as California drought drains lakes http://t.co/kAH1KmTrj7,1
1390,body%20bag,US,Photo: Bath &amp; Body Works cosmetic bag in periwinkle blue with copper piping along the top and four corners.... http://t.co/A9BNlse6QB,0
9314,survive,,A country Chim can survive!,1
3528,derailment,Los Angeles,@AlvinNelson07 A train isn't made to withstand collisions! Immediate derailment. It's totally fucked.,1
7652,panic,"Toronto, Canada",@tim_micallef when do u think Yankees hit the panic button? #TroubleOnMyMind,0
9830,trauma,www.aprylpooley.com,A1: I started writing when I couldn't talk about my trauma in therapy it was the only way I could communicate #gravitychat,0
10004,tsunami,in the Word of God,@GreenLacey GodsLove &amp; #thankU my sister for RT of NEW VIDEO http://t.co/cybKsXHF7d The Coming Apocalyptic US Earthquake &amp; Tsunami,0
9425,survivors,"WV, love the blue and gold",@Arovolturi3000 survived because of magic  she is searching the wood for survivors outside of London,1
2869,damage,Texas,Storm damage reported in West Tennessee http://t.co/90L2lB5WMr,1
10071,typhoon,,abcnews - Obama Declares Disaster for Typhoon-Devastated Saipan: Obama signs disaster declaration for Northern... http://t.co/mg5eAJElul,1
7626,pandemonium,Dallas Fort-Worth,Pandemonium In Aba As Woman Delivers Baby Without Face (Photos) - http://t.co/c5u9qsySeJ,0
10072,typhoon,,Typhoon Soudelor: When will it hit Taiwan ÛÒ and how bad will it be? #GeneralNews http://t.co/cWZHgEzAJ4,1
8644,sinkhole,"Atlanta(ish), GA",Talk on GOZ is fantastic. Most interesting fact so far is that they manually bought all the .ru domains to sinkhole rather than seek co-op.,0
9384,survived,Scotland,@PixelJanosz @Angelheartnight I remember now.  There was a British man who survived both also.  Can't remember his name though.,0
